{
  "format": "readpack-article",
  "format_version": "1.0",
  "article_id": "11111111-1111-4111-8111-111111111111",
  "revision": 1,
  "title": "Minimal Contract Article",
  "source": {
    "display_name": "Engirdle contract fixture",
    "url": null,
    "author": "Engirdle contributors"
  },
  "source_sha256": "f8c3bf62a9aa3e6fc1619c250e48abe7519373d3edf41be62eb5dc45199af2ef",
  "structure_sha256": "945b22576ccaa26a42aa310dbbf042090efc89c369af004bad96359a227c3de2",
  "blocks": [
    {
      "block_id": "block-1",
      "kind": "paragraph",
      "order": 0,
      "sentences": [
        {
          "sentence_id": "sentence-1",
          "order": 0,
          "text": "Hello, world.",
          "translation_zh": "你好，世界。",
          "audio_start_sample": 0,
          "audio_end_sample": 24000,
          "audio_start_ms": 0,
          "audio_end_ms": 1000
        }
      ]
    }
  ]
}
